{
  "schema": "axiom-simulation/claim-record-v1",
  "claim_id": "cross-domain-organizational-execution-20260916",
  "claim": "AXIOM executed five materially different synthetic organizational workflows through the same domain-neutral Research, ASON, and APEX evidence path.",
  "scope": "Five retained validated executable demos: robotics production, software development, specialty-care administration, SOC operations, and logistics/supply chain.",
  "evidence_refs": [
    "robotics-production/evidence/accepted-20260916/evidence.json",
    "software-development/evidence/accepted-20260916/evidence.json",
    "specialty-care-administration/evidence/accepted-20260916/evidence.json",
    "soc-operations/evidence/accepted-20260916/evidence.json",
    "logistics-supply-chain/evidence/accepted-20260916/evidence.json"
  ],
  "evidence_classification": "VALIDATED_EXECUTABLE_DEMO",
  "limitations": [
    "All supporting cases are synthetic local-file demonstrations, not production deployments.",
    "The evidence does not establish regulatory compliance, real-world throughput, economic benefit, or autonomous professional authority.",
    "Completed-effect recovery evidence does not establish exactly-once external effects or distributed recovery."
  ],
  "publication_surfaces": [
    "axiom-demos/organizational-simulations",
    "axiom-llc.github.io/case-studies"
  ]
}
